,cinahl_no,medline_no,cinahl_title,medline_title,cinahl_author,medline_author,not_dup
1338,2640,16477,Interventions for restoring patency of occluded central venous catheter lumens.,Interventions for restoring patency of occluded central venous catheter lumens.,"van Miert C; Hill R; Jones L; Cochrane Database of Systematic Reviews, 2012; (4): N.PAG. (journal article - research, systematic review) ISSN: 1469-493X PMID: 22513946 CINAHL AN: 201153193","van Miert C(1), Hill R, Jones L.",
1339,2643,16489,Intravenous secretin for autism spectrum disorders (ASD).,Intravenous secretin for autism spectrum disorders (ASD).,"Williams K; Wray JA; Wheeler DM; Cochrane Database of Systematic Reviews, 2012; (4): N.PAG. (journal article - research, systematic review) ISSN: 1469-493X PMID: 22513913 CINAHL AN: 200982450","Williams K(1), Wray JA, Wheeler DM.",
1340,2644,16482,Nicotine receptor partial agonists for smoking cessation.,Nicotine receptor partial agonists for smoking cessation.,"Cahill K; Stead LF; Lancaster T; Cochrane Database of Systematic Reviews, 2012; (4): N.PAG. (journal article - research, systematic review) ISSN: 1469-493X PMID: 22513936 CINAHL AN: 200982522","Cahill K(1), Stead LF, Lancaster T.",
1341,2645,16479,Patellar taping for patellofemoral pain syndrome in adults.,Patellar taping for patellofemoral pain syndrome in adults.,"Callaghan MJ; Selfe J; Cochrane Database of Systematic Reviews, 2012; (4): N.PAG. (journal article - meta analysis, research, systematic review) ISSN: 1469-493X PMID: 22513943 CINAHL AN: 201153192","Callaghan MJ(1), Selfe J.",
1342,2646,16490,Prophylactic drug management for febrile seizures in children.,Prophylactic drug management for febrile seizures in children.,"Offringa M; Newton R; Cochrane Database of Systematic Reviews, 2012; (4): N.PAG. (journal article - research, systematic review) ISSN: 1469-493X PMID: 22513908 CINAHL AN: 201153192","Offringa M(1), Newton R.",
1343,2647,16475,Thalidomide for managing cancer cachexia.,Thalidomide for managing cancer cachexia.,"Reid J; Mills M; Cantwell M; Cardwell CR; Murray LJ; Donnelly M; Cochrane Database of Systematic Reviews, 2012; (4): N.PAG. (journal article - research, systematic review) ISSN: 1469-493X PMID: 22513961 CINAHL AN: 201153194","Reid J(1), Mills M, Cantwell M, Cardwell CR, Murray LJ, Donnelly M.",
1344,2648,16487,Treatment for cramps in amyotrophic lateral sclerosis/motor neuron disease.,Treatment for cramps in amyotrophic lateral sclerosis/motor neuron disease.,"Baldinger R; Katzberg HD; Weber M; Cochrane Database of Systematic Reviews, 2012; (4): N.PAG. (journal article - research, systematic review) ISSN: 1469-493X PMID: 22513921 CINAHL AN: 201153192","Baldinger R(1), Katzberg HD, Weber M.",
1345,2649,16486,Treatment for mitochondrial disorders.,Treatment for mitochondrial disorders.,"Pfeffer G; Majamaa K; Turnbull DM; Thorburn D; Chinnery PF; Cochrane Database of Systematic Reviews, 2012; (4): N.PAG. (journal article - research, systematic review) ISSN: 1469-493X PMID: 22513923 CINAHL AN: 200982469","Pfeffer G(1), Majamaa K, Turnbull DM, Thorburn D, Chinnery PF.",
1346,2655,16599,Effects of renin-angiotensin system blockades on cardiovascular outcomes in patients with diabetes mellitus: A systematic review and meta-analysis.,Effects of renin-angiotensin system blockades on cardiovascular outcomes in patients with diabetes mellitus: A systematic review and meta-analysis.,"Nakao YM; Teramukai S; Tanaka S; Yasuno S; Fujimoto A; Kasahara M; Ueshima K; Nakao K; Hinotsu S; Nakao K; et al.; Diabetes Research & Clinical Practice, 2012 Apr; 96 (1): 68-75. (journal article - meta analysis, research, systematic review) ISSN: 0168-8227 PMID: 22197527 CINAHL AN: 201149899","Nakao YM(1), Teramukai S, Tanaka S, Yasuno S, Fujimoto A, Kasahara M, Ueshima K,  Nakao K, Hinotsu S, Nakao K, Kawakami K.",
1347,2670,16632,Translational phases of evidence in a prognostic biomarker: a systematic review and meta-analysis of natriuretic peptides and the prognosis of stable coronary disease.,Translational phases of evidence in a prognostic biomarker: a systematic review and meta-analysis of natriuretic peptides and the prognosis of stable coronary disease.,"Sutaria S; Philipson P; Fitzpatrick NK; Abrams K; Moreno SG; Timmis A; Hingorani AD; Hemingway H; Heart, 2012 Apr; 98 (8): 615-22. (journal article - meta analysis, research, systematic review) ISSN: 1355-6037 PMID: 22388698 CINAHL AN: 201151769","Sutaria S(1), Philipson P, Fitzpatrick NK, Abrams K, Moreno SG, Timmis A, Hingorani AD, Hemingway H.",
1348,2677,16216,Intranasal corticosteroids in management of acute sinusitis: a systematic review and meta-analysis.,Intranasal corticosteroids in management of acute sinusitis: a systematic review  and meta-analysis.,"Hayward G; Heneghan C; Perera R; Thompson M; Annals of Family Medicine, 2012 May-Jun; 10 (3): 241-9. (journal article - meta analysis, research, systematic review) ISSN: 1544-1709 PMID: 22585889 CINAHL AN: 201155447","Hayward G(1), Heneghan C, Perera R, Thompson M.",
1349,2686,16139,Aripiprazole for autism spectrum disorders (ASD).,Aripiprazole for autism spectrum disorders (ASD).,"Ching H; Pringsheim T; Cochrane Database of Systematic Reviews, 2012; (5): N.PAG. (journal article - meta analysis, research, systematic review) ISSN: 1469-493X PMID: 22592735 CINAHL AN: 201155902","Ching H(1), Pringsheim T.",
1350,2687,16147,Bisphosphonates in multiple myeloma: a network meta-analysis.,Bisphosphonates in multiple myeloma: a network meta-analysis.,"Mhaskar R; Redzepovic J; Wheatley K; Clark OAC; Miladinovic B; Glasmacher A; Kumar A; Djulbegovic B; Cochrane Database of Systematic Reviews, 2012; (5): N.PAG. (journal article - research, systematic review) ISSN: 1469-493X PMID: 22592688 CINAHL AN: 200982341","Mhaskar R(1), Redzepovic J, Wheatley K, Clark OA, Miladinovic B, Glasmacher A, Kumar A, Djulbegovic B.",
1351,2688,16144,Chinese herbal medicine for endometriosis.,Chinese herbal medicine for endometriosis.,"Flower A; Liu JP; Lewith G; Little P; Li Q; Cochrane Database of Systematic Reviews, 2012; (5): N.PAG. (journal article - research, systematic review) ISSN: 1469-493X PMID: 22592712 CINAHL AN: 201034888","Flower A(1), Liu JP, Lewith G, Little P, Li Q.",
1352,2689,16150,Cognitive-behavioural interventions for children who have been sexually abused.,Cognitive-behavioural interventions for children who have been sexually abused.,"Macdonald G; Higgins JP; Ramchandani P; Valentine JC; Bronger LP; Klein P; O'Daniel R; Pickering M; Rademaker B; Richardson G; et al.; Cochrane Database of Systematic Reviews, 2012; (5): N.PAG. (journal article - research, systematic review) ISSN: 1469-493X PMID: 22592679 CINAHL AN: 200982480","Macdonald G(1), Higgins JP, Ramchandani P, Valentine JC, Bronger LP, Klein P, O'Daniel R, Pickering M, Rademaker B, Richardson G, Taylor M.",
1353,2690,16149,Early administration of inhaled corticosteroids for preventing chronic lung disease in ventilated very low birth weight preterm neonates.,Early administration of inhaled corticosteroids for preventing chronic lung disease in ventilated very low birth weight preterm neonates.,"Shah VS; Ohlsson A; Halliday HL; Dunn M; Cochrane Database of Systematic Reviews, 2012; (5): N.PAG. (journal article - research, systematic review) ISSN: 1469-493X PMID: 22592680 CINAHL AN: 200982307","Shah VS(1), Ohlsson A, Halliday HL, Dunn M.",
1354,2691,16146,Early skin-to-skin contact for mothers and their healthy newborn infants.,Early skin-to-skin contact for mothers and their healthy newborn infants.,"Moore ER; Anderson GC; Bergman N; Dowswell T; Cochrane Database of Systematic Reviews, 2012; (5): N.PAG. (journal article - research, systematic review) ISSN: 1469-493X PMID: 22592691 CINAHL AN: 200982377","Moore ER(1), Anderson GC, Bergman N, Dowswell T.",
1355,2692,16148,Inhaled versus systemic corticosteroids for the treatment of chronic lung disease in ventilated very low birth weight preterm infants.,Inhaled versus systemic corticosteroids for the treatment of chronic lung disease in ventilated very low birth weight preterm infants.,"Shah SS; Ohlsson A; Halliday HL; Shah VS; Cochrane Database of Systematic Reviews, 2012; (5): N.PAG. (journal article - research, systematic review) ISSN: 1469-493X PMID: 22592682 CINAHL AN: 200982375","Shah SS(1), Ohlsson A, Halliday HL, Shah VS.",
1356,2693,16145,Interventions for non-oliguric hyperkalaemia in preterm neonates.,Interventions for non-oliguric hyperkalaemia in preterm neonates.,"Vemgal P; Ohlsson A; Cochrane Database of Systematic Reviews, 2012; (5): N.PAG. (journal article - research, systematic review) ISSN: 1469-493X PMID: 22592703 CINAHL AN: 200982529","Vemgal P(1), Ohlsson A.",
1357,2694,16141,Nutritional support for liver disease.,Nutritional support for liver disease.,"Koretz RL; Avenell A; Lipman TO; Cochrane Database of Systematic Reviews, 2012; (5): N.PAG. (journal article - meta analysis, research, systematic review) ISSN: 1469-493X PMID: 22592729 CINAHL AN: 201155901","Koretz RL(1), Avenell A, Lipman TO.",
1358,2695,16140,Pacing for drug-refractory or drug-intolerant hypertrophic cardiomyopathy.,Pacing for drug-refractory or drug-intolerant hypertrophic cardiomyopathy.,"Qintar M; Morad A; Alhawasli H; Shorbaji K; Firwana B; Essali A; Kadro W; Cochrane Database of Systematic Reviews, 2012; (5): N.PAG. (journal article - meta analysis, research, systematic review) ISSN: 1469-493X PMID: 22592731 CINAHL AN: 201155901","Qintar M(1), Morad A, Alhawasli H, Shorbaji K, Firwana B, Essali A, Kadro W.",
1359,2696,16142,Radiotherapy and chemoradiation after surgery for early cervical cancer.,Radiotherapy and chemoradiation after surgery for early cervical cancer.,"Rogers L; Siu SSN; Luesley D; Bryant A; Dickinson HO; Cochrane Database of Systematic Reviews, 2012; (5): N.PAG. (journal article - meta analysis, research, systematic review) ISSN: 1469-493X PMID: 22592722 CINAHL AN: 201044553","Rogers L(1), Siu SS, Luesley D, Bryant A, Dickinson HO.",
1360,2697,16143,Spiritual and religious interventions for well-being of adults in the terminal phase of disease.,Spiritual and religious interventions for well-being of adults in the terminal phase of disease.,"Candy B; Jones L; Varagunam M; Speck P; Tookman A; King M; Cochrane Database of Systematic Reviews, 2012; (5): N.PAG. (journal article - research, systematic review) ISSN: 1469-493X PMID: 22592721 CINAHL AN: 201155901","Candy B(1), Jones L, Varagunam M, Speck P, Tookman A, King M.",
1361,2698,16151,Training health professionals in smoking cessation.,Training health professionals in smoking cessation.,"Carson KV; Verbiest ME; Crone MR; Brinn MP; Esterman AJ; Assendelft WJ; Smith BJ; Cochrane Database of Systematic Reviews, 2012; (5): N.PAG. (journal article - research, systematic review) ISSN: 1469-493X PMID: 22592671 CINAHL AN: 200982238","Carson KV(1), Verbiest ME, Crone MR, Brinn MP, Esterman AJ, Assendelft WJ, Smith  BJ.",
1362,2701,16266,"Annualized relapse rate of first-line treatments for multiple sclerosis: a meta-analysis, including indirect comparisons versus fingolimod.","Annualized relapse rate of first-line treatments for multiple sclerosis: a meta-analysis, including indirect comparisons versus fingolimod.","Roskell NS; Zimovetz EA; Rycroft CE; Eckert BJ; Tyas DA; Current Medical Research & Opinion, 2012 May; 28 (5): 767-80. (journal article - meta analysis, research, systematic review) ISSN: 0300-7995 PMID: 22462530 CINAHL AN: 201155461","Roskell NS(1), Zimovetz EA, Rycroft CE, Eckert BJ, Tyas DA.",
1363,2702,16267,Systematic review of efficacy and safety of buprenorphine versus fentanyl or morphine in patients with chronic moderate to severe pain.,Systematic review of efficacy and safety of buprenorphine versus fentanyl or morphine in patients with chronic moderate to severe pain.,"Wolff RF; Aune D; Truyers C; Hernandez AV; Misso K; Riemsma R; Kleijnen J; Current Medical Research & Opinion, 2012 May; 28 (5): 833-45. (journal article - meta analysis, research, systematic review) ISSN: 0300-7995 PMID: 22443154 CINAHL AN: 201155460","Wolff RF(1), Aune D, Truyers C, Hernandez AV, Misso K, Riemsma R, Kleijnen J.",
1364,2714,16354,Device-guided breathing exercises in the control of human blood pressure: systematic review and meta-analysis.,Device-guided breathing exercises in the control of human blood pressure: systematic review and meta-analysis.,"Mahtani KR; Nunan D; Heneghan CJ; Journal of Hypertension, 2012 May; 30 (5): 852-60. (journal article - meta analysis, research, systematic review) ISSN: 0263-6352 PMID: 22495126 CINAHL AN: 201151686","Mahtani KR(1), Nunan D, Heneghan CJ.",
1365,2718,16377,Subglottic secretion drainage for preventing ventilator-associated pneumonia: An updated meta-analysis of randomized controlled trials.,Subglottic secretion drainage for preventing ventilator-associated pneumonia: an  updated meta-analysis of randomized controlled trials.,"Wang F; Bo L; Tang L; Lou J; Wu Y; Chen F; Li J; Deng X; Journal of Trauma & Acute Care Surgery, 2012 May; 72 (5): 1276-85. (journal article - meta analysis, research, systematic review) ISSN: 2163-0755 PMID: 22673255 CINAHL AN: 201157821","Wang F(1), Bo L, Tang L, Lou J, Wu Y, Chen F, Li J, Deng X.",
1366,2719,16376,A meta-analysis of percutaneous compression plate versus sliding hip screw for the management of intertrochanteric fractures of the hip.,A meta-analysis of percutaneous compression plate versus sliding hip screw for the management of intertrochanteric fractures of the hip.,"Cheng T; Zhang GY; Liu T; Zhang XL; Journal of Trauma & Acute Care Surgery, 2012 May; 72 (5): 1435-43. (journal article - meta analysis, research, systematic review) ISSN: 2163-0755 PMID: 22673279 CINAHL AN: 201157823","Cheng T(1), Zhang GY, Liu T, Zhang XL.",
1367,2720,16385,Anal human papillomavirus infection and associated neoplastic lesions in men who have sex with men: a systematic review and meta-analysis.,Anal human papillomavirus infection and associated neoplastic lesions in men who  have sex with men: a systematic review and meta-analysis.,"Machalek DA; Poynten M; Jin F; Fairley CK; Farnsworth A; Garland SM; Hillman RJ; Petoumenos K; Roberts J; Tabrizi SN; et al.; Lancet Oncology, 2012 May; 13 (5): 487-500. (journal article - meta analysis, research, systematic review) ISSN: 1470-2045 PMID: 22445259 CINAHL AN: 201154258","Machalek DA(1), Poynten M, Jin F, Fairley CK, Farnsworth A, Garland SM, Hillman RJ, Petoumenos K, Roberts J, Tabrizi SN, Templeton DJ, Grulich AE.",
1368,2727,16449,Bridging therapy in acute ischemic stroke: a systematic review and meta-analysis.,Bridging therapy in acute ischemic stroke: a systematic review and meta-analysis.,"Mazighi M; Meseguer E; Labreuche J; Amarenco P; Stroke (00392499), 2012 May; 43 (5): 1302-8. (journal article - meta analysis, research, systematic review) ISSN: 0039-2499 PMID: 22529310 CINAHL AN: 201153512","Mazighi M(1), Meseguer E, Labreuche J, Amarenco P.",
1369,2729,16454,Accuracy of imaging parameters in the prediction of lethal pulmonary hypoplasia secondary to mid-trimester prelabor rupture of fetal membranes: a systematic review and meta-analysis.,Accuracy of imaging parameters in the prediction of lethal pulmonary hypoplasia secondary to mid-trimester prelabor rupture of fetal membranes: a systematic review and meta-analysis.,"van Teeffelen AS; Van Der Heijden J; Oei SG; Porath MM; Willekes C; Opmeer B; Mol BW; Ultrasound in Obstetrics & Gynecology, 2012 May; 39 (5): 495-9. (journal article - meta analysis, research, systematic review) ISSN: 0960-7692 PMID: 21793083 CINAHL AN: 201153638","van Teeffelen AS(1), Van Der Heijden J, Oei SG, Porath MM, Willekes C, Opmeer B,  Mol BW.",
1370,2732,16197,Effectiveness of anterior cruciate ligament injury prevention training programs.,Effectiveness of anterior cruciate ligament injury prevention training programs.,"Sadoghi P; von Keudell A; Vavken P; Journal of Bone & Joint Surgery, American Volume, 2012 May 2; 94 (9): 769-76. (journal article - meta analysis, research, systematic review) ISSN: 0021-9355 PMID: 22456856 CINAHL AN: 201154255","Sadoghi P(1), von Keudell A, Vavken P.",
1371,2733,16196,Diagnostic accuracy of magnetic resonance imaging and magnetic resonance arthrography for triangular fibrocartilaginous complex injury: a systematic review and meta-analysis.,Diagnostic accuracy of magnetic resonance imaging and magnetic resonance arthrography for triangular fibrocartilaginous complex injury: a systematic review and meta-analysis.,"Smith TO; Drew B; Toms AP; Jerosch-Herold C; Chojnowski AJ; Journal of Bone & Joint Surgery, American Volume, 2012 May 2; 94 (9): 824-32. (journal article - meta analysis, research, systematic review) ISSN: 0021-9355 PMID: 22552672 CINAHL AN: 201154207","Smith TO(1), Drew B, Toms AP, Jerosch-Herold C, Chojnowski AJ.",
1372,2739,15827,Regional citrate versus heparin anticoagulation for continuous renal replacement therapy: a meta-analysis of randomized controlled trials.,Regional citrate versus heparin anticoagulation for continuous renal replacement  therapy: a meta-analysis of randomized controlled trials.,"Wu MY; Hsu YH; Bai CH; Lin YF; Wu CH; Tam KW; American Journal of Kidney Diseases, 2012 Jun; 59 (6): 810-8. (journal article - meta analysis, research, systematic review) ISSN: 0272-6386 PMID: 22226564 CINAHL AN: 201156054","Wu MY(1), Hsu YH, Bai CH, Lin YF, Wu CH, Tam KW.",
1373,2741,15860,Intrinsic functional deficits associated with increased risk of ankle injuries: a systematic review with meta-analysis.,Intrinsic functional deficits associated with increased risk of ankle injuries: a systematic review with meta-analysis.,"Witchalls J; Blanch P; Waddington G; Adams R; British Journal of Sports Medicine, 2012 Jun; 46 (7): 515-23. (journal article - meta analysis, research, systematic review) ISSN: 0306-3674 PMID: 22171337 CINAHL AN: 201156962","Witchalls J(1), Blanch P, Waddington G, Adams R.",
1374,2742,15869,Meta-analytic comparison of randomized and nonrandomized studies of breast cancer surgery.,Meta-analytic comparison of randomized and nonrandomized studies of breast cancer surgery.,"Edwards JP; Kelly EJ; Lin Y; Lenders T; Ghali WA; Graham AJ; Canadian Journal of Surgery, 2012 Jun; 55 (3): 155-62. (journal article - research, systematic review) ISSN: 0008-428X PMID: 22449722 CINAHL AN: 201156248","Edwards JP(1), Kelly EJ, Lin Y, Lenders T, Ghali WA, Graham AJ.",
1375,2745,15792,Adjuvant platinum-based chemotherapy for early stage cervical cancer.,Adjuvant platinum-based chemotherapy for early stage cervical cancer.,"Rosa DD; Medeiros LR; Edelweiss MI; Pohlmann PR; Stein AT; Cochrane Database of Systematic Reviews, 2012; (6): N.PAG. (journal article - research, systematic review) ISSN: 1469-493X PMID: 22696349 CINAHL AN: 201034886","Rosa DD(1), Medeiros LR, Edelweiss MI, Pohlmann PR, Stein AT.",
1376,2746,15789,Chemotherapy for brain metastases from small cell lung cancer.,Chemotherapy for brain metastases from small cell lung cancer.,"Reveiz L; Rueda J; Cardona AF; Cochrane Database of Systematic Reviews, 2012; (6): N.PAG. (journal article - research, systematic review) ISSN: 1469-493X PMID: 22696370 CINAHL AN: 201163262","Reveiz L(1), Rueda JR, Cardona AF.",
1377,2747,15784,Colony-stimulating factors for prevention and treatment of infectious complications in patients with acute myelogenous leukemia.,Colony-stimulating factors for prevention and treatment of infectious complications in patients with acute myelogenous leukemia.,"Gurion R; Belnik-Plitman Y; Gafter-Gvili A; Paul M; Vidal L; Ben-Bassat I; Shpilberg O; Raanani P; Cochrane Database of Systematic Reviews, 2012; (6): N.PAG. (journal article - meta analysis, research, systematic review) ISSN: 1469-493X PMID: 22696376 CINAHL AN: 201127038","Gurion R(1), Belnik-Plitman Y, Gafter-Gvili A, Paul M, Vidal L, Ben-Bassat I, Shpilberg O, Raanani P.",
1378,2748,15794,Cromolyn sodium for the prevention of chronic lung disease in preterm infants.,Cromolyn sodium for the prevention of chronic lung disease in preterm infants.,"Ng G; Ohlsson A; Cochrane Database of Systematic Reviews, 2012; (6): N.PAG. (journal article - research, systematic review) ISSN: 1469-493X PMID: 22696332 CINAHL AN: 200982337","Ng G(1), Ohlsson A.",
1379,2749,15788,Enhanced glucose control for preventing and treating diabetic neuropathy.,Enhanced glucose control for preventing and treating diabetic neuropathy.,"Callaghan BC; Little AA; Feldman EL; Hughes RA; Cochrane Database of Systematic Reviews, 2012; (6): N.PAG. (journal article - meta analysis, research, systematic review) ISSN: 1469-493X PMID: 22696371 CINAHL AN: 201163262","Callaghan BC(1), Little AA, Feldman EL, Hughes RA.",
1380,2750,15787,Ganoderma lucidum (Reishi mushroom) for cancer treatment.,Ganoderma lucidum (Reishi mushroom) for cancer treatment.,"Jin X; Ruiz Beguerie J; Sze DM; Chan GC; Cochrane Database of Systematic Reviews, 2012; (6): N.PAG. (journal article - research, systematic review) ISSN: 1469-493X PMID: 22696372 CINAHL AN: 201163262","Jin X(1), Ruiz Beguerie J, Sze DM, Chan GC.",
1381,2751,15793,Healthcare financing systems for increasing the use of tobacco dependence treatment.,Healthcare financing systems for increasing the use of tobacco dependence treatment.,"Reda AA; Kotz D; Evers SMAA; van Schayck CP; Cochrane Database of Systematic Reviews, 2012; (6): N.PAG. (journal article - research, systematic review) ISSN: 1469-493X PMID: 22696341 CINAHL AN: 200982435","Reda AA(1), Kotz D, Evers SM, van Schayck CP.",
1382,2752,15795,Intravenous midazolam infusion for sedation of infants in the neonatal intensive care unit.,Intravenous midazolam infusion for sedation of infants in the neonatal intensive  care unit.,"Ng E; Taddio A; Ohlsson A; Cochrane Database of Systematic Reviews, 2012; (6): N.PAG. (journal article - research, systematic review) ISSN: 1469-493X PMID: 22696328 CINAHL AN: 200982313","Ng E(1), Taddio A, Ohlsson A.",
1383,2755,15791,Radiofrequency ablation in the treatment of liver metastases from colorectal cancer.,Radiofrequency ablation in the treatment of liver metastases from colorectal cancer.,"Cirocchi R; Trastulli S; Boselli C; Montedori A; Cavaliere D; Parisi A; Noya G; Abraha I; Cochrane Database of Systematic Reviews, 2012; (6): N.PAG. (journal article - research, systematic review) ISSN: 1469-493X PMID: 22696357 CINAHL AN: 201163261","Cirocchi R(1), Trastulli S, Boselli C, Montedori A, Cavaliere D, Parisi A, Noya G, Abraha I.",
1384,2756,15783,Second trimester serum tests for Down's Syndrome screening.,Second trimester serum tests for Down's Syndrome screening.,"Alldred SK; Deeks JJ; Guo B; Neilson JP; Alfirevic Z; Cochrane Database of Systematic Reviews, 2012; (6): N.PAG. (journal article - meta analysis, research, systematic review) ISSN: 1469-493X PMID: 22696388 CINAHL AN: 201163264","Alldred SK(1), Deeks JJ, Guo B, Neilson JP, Alfirevic Z.",
1385,2757,15790,Sedative techniques for endoscopic retrograde cholangiopancreatography.,Sedative techniques for endoscopic retrograde cholangiopancreatography.,"Garewal D; Powell S; Milan SJ; Nordmeyer J; Waikar P; Cochrane Database of Systematic Reviews, 2012; (6): N.PAG. (journal article - research, systematic review) ISSN: 1469-493X PMID: 22696368 CINAHL AN: 201163262","Garewal D(1), Powell S, Milan SJ, Nordmeyer J, Waikar P.",
1386,2758,15786,Topical microbicides for prevention of sexually transmitted infections.,Topical microbicides for prevention of sexually transmitted infections.,"Obiero J; Mwethera PG; Wiysonge CS; Cochrane Database of Systematic Reviews, 2012; (6): N.PAG. (journal article - randomized controlled trial, research, systematic review) ISSN: 1469-493X PMID: 22696373 CINAHL AN: 201163263","Obiero J(1), Mwethera PG, Wiysonge CS.",
1387,2759,15785,Virtual reality simulation training for health professions trainees in gastrointestinal endoscopy.,Virtual reality simulation training for health professions trainees in gastrointestinal endoscopy.,"Walsh CM; Sherlock ME; Ling SC; Carnahan H; Cochrane Database of Systematic Reviews, 2012; (6): N.PAG. (journal article - research, systematic review) ISSN: 1469-493X PMID: 22696375 CINAHL AN: 201163263","Walsh CM(1), Sherlock ME, Ling SC, Carnahan H.",
1388,2760,15896,Could ginseng-based medicines be better than nitrates in treating ischemic heart disease? A systematic review and meta-analysis of randomized controlled trials.,Could ginseng-based medicines be better than nitrates in treating ischemic heart  disease? A systematic review and meta-analysis of randomized controlled trials.,"Jia Y; Zhang S; Huang F; Leung SW; Complementary Therapies in Medicine, 2012 Jun; 20 (3): 155-66. (journal article - meta analysis, research, systematic review) ISSN: 0965-2299 PMID: 22500665 CINAHL AN: 201151760","Jia Y(1), Zhang S, Huang F, Leung SW.",
1389,2761,15899,Delirium screening in critically ill patients: A systematic review and meta-analysis.,Delirium screening in critically ill patients: a systematic review and meta-analysis.,"Neto AS; Nassar AP Jr; Cardoso SO; Manetta JA; Pereira VG; EspÌ_sito DC; Damasceno MC; Slooter AJ; Critical Care Medicine, 2012 Jun; 40 (6): 1946-51. (journal article - meta analysis, research, systematic review) ISSN: 0090-3493 PMID: 22610196 CINAHL AN: 201155615","Neto AS(1), Nassar AP Jr, Cardoso SO, Manetta JA, Pereira VG, EspÌ_sito DC, Damasceno MC, Slooter AJ.",
