,cinahl_no,medline_no,cinahl_title,medline_title,cinahl_author,medline_author,not_dup
930,1630,24053,Duration of adjuvant chemotherapy for patients with non-metastatic colorectal cancer.,Duration of adjuvant chemotherapy for patients with non-metastatic colorectal cancer.,"Des Guetz G; Uzzan B; Morere J; Perret G; Nicolas P; Cochrane Database of Systematic Reviews, 2010: N.PAG. (journal article - meta analysis, research, systematic review) ISSN: 1469-493X PMID: 20091614 CINAHL AN: 201056913","Des Guetz G(1), Uzzan B, Morere JF, Perret G, Nicolas P.",
931,1631,22164,Effects of communicating DNA-based disease risk estimates on risk-reducing behaviours.,Effects of communicating DNA-based disease risk estimates on risk-reducing behaviours.,"Marteau TM; French DP; Griffin SJ; Prevost AT; Sutton S; Watkinson C; Attwood S; Hollands GJ; Cochrane Database of Systematic Reviews, 2010: N.PAG. (journal article - research, systematic review) ISSN: 1469-493X PMID: 20927756 CINAHL AN: 201084165","Marteau TM(1), French DP, Griffin SJ, Prevost AT, Sutton S, Watkinson C, Attwood  S, Hollands GJ.",
932,1632,24048,Erythropoiesis-stimulating agents for anaemia in chronic heart failure patients.,Erythropoiesis-stimulating agents for anaemia in chronic heart failure patients.,"Ngo K; Kotecha D; Walters JA; Manzano L; Palazzuoli A; van Veldhuisen DJ; Flather M; Cochrane Database of Systematic Reviews, 2010: N.PAG. (journal article - research, systematic review) ISSN: 1469-493X PMID: 20091643 CINAHL AN: 201056909","Ngo K(1), Kotecha D, Walters JA, Manzano L, Palazzuoli A, van Veldhuisen DJ, Flather M.",
933,1633,24061,Ethamsylate for the prevention of morbidity and mortality in preterm or very low birth weight infants.,Ethamsylate for the prevention of morbidity and mortality in preterm or very low  birth weight infants.,"Hunt R; Hey E; Cochrane Database of Systematic Reviews, 2010: N.PAG. (journal article - research, systematic review) ISSN: 1469-493X PMID: 20091562 CINAHL AN: 201056910","Hunt R(1), Hey E.",
934,1634,22800,Evaluation of the efficacy and safety of adjuvant treatment to levodopa therapy in Parkinson s disease patients with motor complications.,Evaluation of the efficacy and safety of adjuvant treatment to levodopa therapy in Parkinson s disease patients with motor complications.,"Stowe R; Ives N; Clarke CE; Deane K; van Hilten; Wheatley K; Gray R; Handley K; Furmston A; Cochrane Database of Systematic Reviews, 2010: N.PAG. (journal article - meta analysis, research, systematic review) ISSN: 1469-493X PMID: 20614454 CINAHL AN: 201084156","Stowe R(1), Ives N, Clarke CE, Deane K; van Hilten, Wheatley K, Gray R, Handley K, Furmston A.",
935,1635,23487,Family therapy for anorexia nervosa.,Family therapy for anorexia nervosa.,"Fisher CA; Hetrick SE; Rushford N; Cochrane Database of Systematic Reviews, 2010: N.PAG. (journal article - meta analysis, research, systematic review) ISSN: 1469-493X PMID: 20393940 CINAHL AN: 201065213","Fisher CA(1), Hetrick SE, Rushford N.",
936,1636,24045,Fluoride toothpastes of different concentrations for preventing dental caries in children and adolescents.,Fluoride toothpastes of different concentrations for preventing dental caries in  children and adolescents.,"Walsh T; Worthington HV; Glenny A; Appelbe P; Marinho VC; Shi X; Cochrane Database of Systematic Reviews, 2010: N.PAG. (journal article - clinical trial, meta analysis, research, systematic review) ISSN: 1469-493X PMID: 20091655 CINAHL AN: 201056916","Walsh T(1), Worthington HV, Glenny AM, Appelbe P, Marinho VC, Shi X.",
937,1637,23688,Group-based parent-training programmes for improving emotional and behavioural adjustment in children from birth to three years old.,Group-based parent-training programmes for improving emotional and behavioural adjustment in children from birth to three years old.,"Barlow J; Smailagic N; Ferriter M; Bennett C; Jones H; Cochrane Database of Systematic Reviews, 2010: N.PAG. (journal article - research, systematic review) ISSN: 1469-493X PMID: 20238324 CINAHL AN: 200982361","Barlow J(1), Smailagic N, Ferriter M, Bennett C, Jones H.",
938,1638,24070,Growth hormone for in vitro fertilization.,Growth hormone for in vitro fertilization.,"Duffy JM; Ahmad G; Mohiyiddeen L; Nardo LG; Watson A; Cochrane Database of Systematic Reviews, 2010: N.PAG. (journal article - research, systematic review) ISSN: 1469-493X PMID: 20091500 CINAHL AN: 200982227","Duffy JM(1), Ahmad G, Mohiyiddeen L, Nardo LG, Watson A.",
939,1639,22165,Hand assisted laparoscopic surgery versus conventional laparoscopy for colorectal surgery.,Hand assisted laparoscopic surgery versus conventional laparoscopy for colorectal surgery.,"Moloo H; Haggar F; Coyle D; Hutton B; Duhaime S; Mamazza J; Poulin EC; Boushey RP; Grimshaw J; Cochrane Database of Systematic Reviews, 2010: N.PAG. (journal article - research, systematic review) ISSN: 1469-493X PMID: 20927747 CINAHL AN: 201084165","Moloo H(1), Haggar F, Coyle D, Hutton B, Duhaime S, Mamazza J, Poulin EC, Boushey RP, Grimshaw J.",
940,1640,29416,House dust mite avoidance measures for perennial allergic rhinitis.,House dust mite avoidance measures for perennial allergic rhinitis.,"Sheikh A; Hurwitz B; Nurmatov U; van Schayck CP; Cochrane Database of Systematic Reviews, 2010: N.PAG. (journal article - research, systematic review) ISSN: 1469-493X PMID: 20614426 CINAHL AN: 200982293","Sheikh A(1), Hurwitz B, Shehata Y.",
941,1641,23273,Human chorionic gonadotrophin for threatened miscarriage.,Human chorionic gonadotrophin for threatened miscarriage.,"Devaseelan P; Fogarty PP; Regan L; Cochrane Database of Systematic Reviews, 2010: N.PAG. (journal article - meta analysis, research, systematic review) ISSN: 1469-493X PMID: 20464754 CINAHL AN: 201084145","Devaseelan P(1), Fogarty PP, Regan L.",
942,1642,21727,Hyperfractionated or accelerated radiotherapy for head and neck cancer.,Hyperfractionated or accelerated radiotherapy for head and neck cancer.,"Baujat B; Bourhis J; Blanchard P; Overgaard J; Ang KK; Saunders M; Le MaÌ¨tre A; Bernier J; Horiot JC; Maillard E; et al.; Cochrane Database of Systematic Reviews, 2010: N.PAG. (journal article - research, systematic review) ISSN: 1469-493X PMID: 21154350 CINAHL AN: 201089672","Baujat B(1), Bourhis J, Blanchard P, Overgaard J, Ang KK, Saunders M, Le MaÌ¨tre A, Bernier J, Horiot JC, Maillard E, Pajak TF, Poulsen MG, Bourredjem A, O'Sullivan B, Dobrowsky W, Andrzej H, Skladowski K, Hay JH, Pinto LH, Fu KK, Fallai C, Sylvester R, Pignon JP; MARCH Collaborative Group.",
943,1644,22169,Hypnotherapy for smoking cessation.,Hypnotherapy for smoking cessation.,"Barnes J; Dong CY; McRobbie H; Walker N; Mehta M; Stead LF; Cochrane Database of Systematic Reviews, 2010: N.PAG. (journal article - research, systematic review) ISSN: 1469-493X PMID: 20927723 CINAHL AN: 200982264","Barnes J(1), Dong CY, McRobbie H, Walker N, Mehta M, Stead LF.",
944,1645,23282,Immediate post-partum insertion of intrauterine devices.,Immediate post-partum insertion of intrauterine devices.,"Grimes DA; Lopez LM; Schulz KF; Van Vliet HA; Stanwood NL; Cochrane Database of Systematic Reviews, 2010: N.PAG. (journal article - research, systematic review) ISSN: 1469-493X PMID: 20464722 CINAHL AN: 200982337","Grimes DA(1), Lopez LM, Schulz KF, Van Vliet HA, Stanwood NL.",
945,1646,22395,Interactive computer-based interventions for sexual health promotion.,Interactive computer-based interventions for sexual health promotion.,"Bailey JV; Murray E; Rait G; Mercer CH; Morris RW; Peacock R; Cassell J; Nazareth I; Cochrane Database of Systematic Reviews, 2010: N.PAG. (journal article - research, systematic review) ISSN: 1469-493X PMID: 20824850 CINAHL AN: 201084161","Bailey JV(1), Murray E, Rait G, Mercer CH, Morris RW, Peacock R, Cassell J, Nazareth I.",
946,1647,23865,Interventions for preventing posterior capsule opacification.,Interventions for preventing posterior capsule opacification.,"Findl O; Buehl W; Bauer P; Sycha T; Cochrane Database of Systematic Reviews, 2010: N.PAG. (journal article - research, systematic review) ISSN: 1469-493X PMID: 20166069 CINAHL AN: 200982230","Findl O(1), Buehl W, Bauer P, Sycha T.",
947,1650,22611,Interventions for treating oral mucositis for patients with cancer receiving treatment.,Interventions for treating oral mucositis for patients with cancer receiving treatment.,"Clarkson JE; Worthington HV; Furness S; McCabe M; Khalid T; Meyer S; Cochrane Database of Systematic Reviews, 2010: N.PAG. (journal article - research, systematic review) ISSN: 1469-493X PMID: 20687070 CINAHL AN: 200982308","Clarkson JE(1), Worthington HV, Furness S, McCabe M, Khalid T, Meyer S.",
948,1651,23272,Iron supplementation for breath-holding attacks in children.,Iron supplementation for breath-holding attacks in children.,"Zehetner AA; Orr N; Buckmaster A; Williams K; Wheeler DM; Cochrane Database of Systematic Reviews, 2010: N.PAG. (journal article - meta analysis, research, systematic review) ISSN: 1469-493X PMID: 20464763 CINAHL AN: 201084146","Zehetner AA(1), Orr N, Buckmaster A, Williams K, Wheeler DM.",
949,1652,23274,Joint lavage for osteoarthritis of the knee.,Joint lavage for osteoarthritis of the knee.,"Reichenbach S; Rutjes AW; NÌ_esch E; Trelle S; JÌ_ni P; Cochrane Database of Systematic Reviews, 2010: N.PAG. (journal article - research, systematic review) ISSN: 1469-493X PMID: 20464751 CINAHL AN: 201084145","Reichenbach S(1), Rutjes AW, NÌ_esch E, Trelle S, JÌ_ni P.",
950,1653,22797,Lactulose versus Polyethylene Glycol for Chronic Constipation.,Lactulose versus Polyethylene Glycol for Chronic Constipation.,"Lee-Robichaud H; Thomas K; Morgan J; Nelson RL; Cochrane Database of Systematic Reviews, 2010: N.PAG. (journal article - meta analysis, research, systematic review) ISSN: 1469-493X PMID: 20614462 CINAHL AN: 201084157","Lee-Robichaud H(1), Thomas K, Morgan J, Nelson RL.",
951,1655,23687,Lay health workers in primary and community health care for maternal and child health and the management of infectious diseases.,Lay health workers in primary and community health care for maternal and child health and the management of infectious diseases.,"Lewin S; Munabi-Babigumira S; Glenton C; Daniels K; Bosch-Capblanch X; van Wyk BE; Odgaard-Jensen J; Johansen M; Aja GN; Zwarenstein M; et al.; Cochrane Database of Systematic Reviews, 2010: N.PAG. (journal article - research, systematic review) ISSN: 1469-493X PMID: 20238326 CINAHL AN: 200982434","Lewin S(1), Munabi-Babigumira S, Glenton C, Daniels K, Bosch-Capblanch X, van Wyk BE, Odgaard-Jensen J, Johansen M, Aja GN, Zwarenstein M, Scheel IB.",
952,1657,24057,Long-term opioid management for chronic noncancer pain.,Long-term opioid management for chronic noncancer pain.,"Noble M; Treadwell JR; Tregear SJ; Coates VH; Wiffen PJ; Akafomo C; Schoelles KM; Cochrane Database of Systematic Reviews, 2010: N.PAG. (journal article - research, systematic review) ISSN: 1469-493X PMID: 20091598 CINAHL AN: 201056909","Noble M(1), Treadwell JR, Tregear SJ, Coates VH, Wiffen PJ, Akafomo C, Schoelles  KM.",
953,1658,24049,Lymphadenectomy for the management of endometrial cancer.,Lymphadenectomy for the management of endometrial cancer.,"May K; Bryant A; Dickinson HO; Kehoe S; Morrison J; Cochrane Database of Systematic Reviews, 2010: N.PAG. (journal article - meta analysis, research, systematic review) ISSN: 1469-493X PMID: 20091639 CINAHL AN: 201056914","May K(1), Bryant A, Dickinson HO, Kehoe S, Morrison J.",
954,1659,21726,Micronutrient supplementation in children and adults with HIV infection.,Micronutrient supplementation in children and adults with HIV infection.,"Irlam JH; Visser MM; Rollins NN; Siegfried N; Cochrane Database of Systematic Reviews, 2010: N.PAG. (journal article - research, systematic review) ISSN: 1469-493X PMID: 21154354 CINAHL AN: 200982459","Irlam JH(1), Visser MM, Rollins NN, Siegfried N.",
955,1661,22167,Opiate treatment for opiate withdrawal in newborn infants.,Opiate treatment for opiate withdrawal in newborn infants.,"Osborn DA; Jeffery HE; Cole MJ; Cochrane Database of Systematic Reviews, 2010: N.PAG. (journal article - research, systematic review) ISSN: 1469-493X PMID: 20927730 CINAHL AN: 200982350","Osborn DA(1), Jeffery HE, Cole MJ.",
956,1663,21939,Pain relief for outpatient hysteroscopy.,Pain relief for outpatient hysteroscopy.,"Ahmad G; O'Flynn H; Attarbashi S; Duffy JM; Watson A; Cochrane Database of Systematic Reviews, 2010: N.PAG. (journal article - meta analysis, research, systematic review) ISSN: 1469-493X PMID: 21069695 CINAHL AN: 201087229","Ahmad G(1), O'Flynn H, Attarbashi S, Duffy JM, Watson A.",
957,1667,21945,Prophylactic mastectomy for the prevention of breast cancer.,Prophylactic mastectomy for the prevention of breast cancer.,"Lostumbo L; Carbine NE; Wallace J; Cochrane Database of Systematic Reviews, 2010: N.PAG. (journal article - research, systematic review) ISSN: 1469-493X PMID: 21069671 CINAHL AN: 200982423","Lostumbo L(1), Carbine NE, Wallace J.",
958,1668,21729,Prophylactic methylxanthine for prevention of apnoea in preterm infants.,Prophylactic methylxanthine for prevention of apnoea in preterm infants.,"Henderson-Smart DJ; De Paoli AG; Cochrane Database of Systematic Reviews, 2010: N.PAG. (journal article - meta analysis, research, systematic review) ISSN: 1469-493X PMID: 21154344 CINAHL AN: 200982250","Henderson-Smart DJ(1), De Paoli AG.",
959,1669,21730,Prophylactic methylxanthines for endotracheal extubation in preterm infants.,Prophylactic methylxanthines for endotracheal extubation in preterm infants.,"Henderson-Smart DJ; Davis PG; Cochrane Database of Systematic Reviews, 2010: N.PAG. (journal article - meta analysis, research, systematic review) ISSN: 1469-493X PMID: 21154342 CINAHL AN: 200982231","Henderson-Smart DJ(1), Davis PG.",
960,1670,24069,Prophylactic protein free synthetic surfactant for preventing morbidity and mortality in preterm infants.,Prophylactic protein free synthetic surfactant for preventing morbidity and mortality in preterm infants.,"Soll R; Zek E; Cochrane Database of Systematic Reviews, 2010: N.PAG. (journal article - research, systematic review) ISSN: 1469-493X PMID: 20091513 CINAHL AN: 200982268","Soll R(1), Ozek E.",
961,1671,24058,Prostanoids for critical limb ischaemia.,Prostanoids for critical limb ischaemia.,"Ruffolo AJ; Romano M; Ciapponi A; Cochrane Database of Systematic Reviews, 2010: N.PAG. (journal article - research, systematic review) ISSN: 1469-493X PMID: 20091595 CINAHL AN: 201056918","Ruffolo AJ(1), Romano M, Ciapponi A.",
962,1675,22168,Sedatives for opiate withdrawal in newborn infants.,Sedatives for opiate withdrawal in newborn infants.,"Osborn DA; Jeffery HE; Cole MJ; Cochrane Database of Systematic Reviews, 2010: N.PAG. (journal article - research, systematic review) ISSN: 1469-493X PMID: 20927729 CINAHL AN: 200982350","Osborn DA(1), Jeffery HE, Cole MJ.",
963,1676,23486,Sertraline versus other antidepressive agents for depression.,Sertraline versus other antidepressive agents for depression.,"Cipriani A; La Ferla T; Furukawa TA; Signoretti A; Nakagawa A; Churchill R; McGuire H; Barbui C; Cochrane Database of Systematic Reviews, 2010: N.PAG. (journal article - research, systematic review) ISSN: 1469-493X PMID: 20393946 CINAHL AN: 201028183","Cipriani A(1), La Ferla T, Furukawa TA, Signoretti A, Nakagawa A, Churchill R, McGuire H, Barbui C.",
964,1679,22609,Spironolactone for hypertension.,Spironolactone for hypertension.,"Batterink J; Stabler SN; Tejani AM; Fowkes CT; Cochrane Database of Systematic Reviews, 2010: N.PAG. (journal article - meta analysis, research, systematic review) ISSN: 1469-493X PMID: 20687095 CINAHL AN: 201084160","Batterink J(1), Stabler SN, Tejani AM, Fowkes CT.",
965,1680,21942,Stage-based interventions for smoking cessation.,Stage-based interventions for smoking cessation.,"Cahill K; Lancaster T; Green N; Cochrane Database of Systematic Reviews, 2010: N.PAG. (journal article - meta analysis, research, systematic review) ISSN: 1469-493X PMID: 21069681 CINAHL AN: 201087228","Cahill K(1), Lancaster T, Green N.",
966,1683,22163,Telehealthcare for asthma.,Telehealthcare for asthma.,"McLean S; Chandler D; Nurmatov U; Liu JL; Pagliari C; Car J; Sheikh A; Cochrane Database of Systematic Reviews, 2010: N.PAG. (journal article - research, systematic review) ISSN: 1469-493X PMID: 20927763 CINAHL AN: 201084166","McLean S(1), Chandler D, Nurmatov U, Liu J, Pagliari C, Car J, Sheikh A.",
967,1684,24065,Therapeutic ultrasound for osteoarthritis of the knee or hip.,Therapeutic ultrasound for osteoarthritis of the knee or hip.,"Rutjes AW; NÌ_esch E; Sterchi R; JÌ_ni P; Cochrane Database of Systematic Reviews, 2010: N.PAG. (journal article - research, systematic review) ISSN: 1469-493X PMID: 20091539 CINAHL AN: 200982339","Rutjes AW(1), NÌ_esch E, Sterchi R, JÌ_ni P.",
968,1685,24047,Topical fluoride as a cause of dental fluorosis in children.,Topical fluoride as a cause of dental fluorosis in children.,"Wong MC; Glenny A; Tsang BW; Lo EC; Worthington HV; Marinho VC; Cochrane Database of Systematic Reviews, 2010: N.PAG. (journal article - research, systematic review) ISSN: 1469-493X PMID: 20091645 CINAHL AN: 201056913","Wong MC(1), Glenny AM, Tsang BW, Lo EC, Worthington HV, Marinho VC.",
969,1689,23280,Treatment of periodontal disease for glycaemic control in people with diabetes.,Treatment of periodontal disease for glycaemic control in people with diabetes.,"Simpson TC; Needleman I; Wild SH; Moles DR; Mills EJ; Cochrane Database of Systematic Reviews, 2010: N.PAG. (journal article - meta analysis, research, systematic review) ISSN: 1469-493X PMID: 20464734 CINAHL AN: 201084143","Simpson TC(1), Needleman I, Wild SH, Moles DR, Mills EJ.",
970,1690,22170,Vaginal misoprostol for cervical ripening and induction of labour.,Vaginal misoprostol for cervical ripening and induction of labour.,"Hofmeyr GJ; GÌ_lmezoglu AM; Pileggi C; Cochrane Database of Systematic Reviews, 2010: N.PAG. (journal article - research, systematic review) ISSN: 1469-493X PMID: 20927722 CINAHL AN: 200982258","Hofmeyr GJ(1), GÌ_lmezoglu AM, Pileggi C.",
971,1691,24051,Visual feedback of individuals' medical imaging results for changing health behaviour.,Visual feedback of individuals' medical imaging results for changing health behaviour.,"Hollands GJ; Hankins M; Marteau TM; Cochrane Database of Systematic Reviews, 2010: N.PAG. (journal article - research, systematic review) ISSN: 1469-493X PMID: 20091633 CINAHL AN: 201056914","Hollands GJ(1), Hankins M, Marteau TM.",
972,1692,21719,Vitamin A supplementation for preventing morbidity and mortality in children from 6 months to 5 years of age.,Vitamin A supplementation for preventing morbidity and mortality in children from 6 months to 5 years of age.,"Imdad A; Herzer K; Mayo-Wilson E; Yakoob MY; Bhutta ZA; Cochrane Database of Systematic Reviews, 2010: N.PAG. (journal article - meta analysis, research, systematic review) ISSN: 1469-493X PMID: 21154399 CINAHL AN: 201089676","Imdad A(1), Herzer K, Mayo-Wilson E, Yakoob MY, Bhutta ZA.",
973,1693,21943,Volume-targeted versus pressure-limited ventilation in the neonate.,Volume-targeted versus pressure-limited ventilation in the neonate.,"Wheeler K; Klingenberg C; McCallion N; Morley CJ; Davis PG; Cochrane Database of Systematic Reviews, 2010: N.PAG. (journal article - research, systematic review) ISSN: 1469-493X PMID: 21069677 CINAHL AN: 200982451","Wheeler K(1), Klingenberg C, McCallion N, Morley CJ, Davis PG.",
974,1695,21723,Zinc supplementation for the prevention of pneumonia in children aged 2 months to 59 months.,Zinc supplementation for the prevention of pneumonia in children aged 2 months to 59 months.,"Lassi ZS; Haider BA; Bhutta ZA; Cochrane Database of Systematic Reviews, 2010: N.PAG. (journal article - meta analysis, research, systematic review) ISSN: 1469-493X PMID: 21154362 CINAHL AN: 201089672","Lassi ZS(1), Haider BA, Bhutta ZA.",
975,1696,24169,Association between tumor necrosis factor-alpha promoter -308 A/G polymorphism and susceptibility to sepsis and sepsis mortality: a systematic review and meta-analysis.,Association between tumor necrosis factor-alpha promoter -308 A/G polymorphism and susceptibility to sepsis and sepsis mortality: a systematic review and meta-analysis.,"Teuffel O; Ethier MC; Beyene J; Sung L; Critical Care Medicine, 2010 Jan; 38 (1): 276-82. (journal article - meta analysis, research, systematic review) ISSN: 0090-3493 PMID: 19789454 CINAHL AN: 201052593","Teuffel O(1), Ethier MC, Beyene J, Sung L.",
976,1698,20829,Residential pesticides and childhood leukemia: a systematic review and meta-analysis.,Residential pesticides and childhood leukemia: a systematic review and meta-analysis.,"Turner MC; Wigle DT; Krewski D; Environmental Health Perspectives, 2010 Jan; 118 (1): 33-41. (journal article - meta analysis, research, systematic review, tables/charts) ISSN: 0091-6765 PMID: 20056585 CINAHL AN: 201060551","Turner MC(1), Wigle DT, Krewski D.",
977,1699,24188,The addition of tocilizumab to DMARD therapy for rheumatoid arthritis: a meta-analysis of randomized controlled trials.,The addition of tocilizumab to DMARD therapy for rheumatoid arthritis: a meta-analysis of randomized controlled trials.,"An M; Zou Z; Shen H; Zhang J; Cao Y; Jiang Y; European Journal of Clinical Pharmacology, 2010 Jan; 66 (1): 49-59. (journal article - research, systematic review) ISSN: 0031-6970 PMID: 19936725 CINAHL AN: 201052294","An MM(1), Zou Z, Shen H, Zhang JD, Cao YB, Jiang YY.",
978,1700,22904,"A systematic review of photodynamic therapy in the treatment of pre-cancerous skin conditions, Barrett's oesophagus and cancers of the biliary tract, brain, head and neck, lung, oesophagus and skin.","A systematic review of photodynamic therapy in the treatment of pre-cancerous skin conditions, Barrett's oesophagus and cancers of the biliary tract, brain, head and neck, lung, oesophagus and skin.","Fayter D; Corbett M; Heirs M; Fox D; Eastwood A; Health Technology Assessment, 2010; 14 (37): 1-288. (journal article - research, systematic review) ISSN: 1366-5278 PMID: 20663420 CINAHL AN: 201072874","Fayter D(1), Corbett M, Heirs M, Fox D, Eastwood A.",
979,1701,23127,Chemoprevention of colorectal cancer: systematic review and economic evaluation.,Chemoprevention of colorectal cancer: systematic review and economic evaluation.,"Cooper K; Squires H; Carroll C; Papaioannou D; Booth A; Logan R; Maguire C; Hind D; Tappenden P; Health Technology Assessment, 2010; 14 (32): 1-206. (journal article - meta analysis, research, systematic review) ISSN: 1366-5278 PMID: 20594533 CINAHL AN: 201070187","Cooper K(1), Squires H, Carroll C, Papaioannou D, Booth A, Logan RF, Maguire C, Hind D, Tappenden P.",
980,1703,22905,Newer agents for blood glucose control in type 2 diabetes: systematic review and economic evaluation.,Newer agents for blood glucose control in type 2 diabetes: systematic review and  economic evaluation.,"Waugh N; Cummins E; Royle P; Clar C; Marien M; Richter B; Philip S; Health Technology Assessment, 2010; 14 (36): 1-248. (journal article - meta analysis, research, systematic review) ISSN: 1366-5278 PMID: 20646668 CINAHL AN: 201072407","Waugh N(1), Cummins E, Royle P, Clar C, Marien M, Richter B, Philip S.",
981,1705,22490,Screening for hyperglycaemia in pregnancy: a rapid update for the National Screening Committee.,Screening for hyperglycaemia in pregnancy: a rapid update for the National Screening Committee.,"Waugh N; Royle P; Clar C; Henderson R; Cummins E; Hadden D; Lindsay R; Pearson D; Health Technology Assessment, 2010; 14 (45): 1-183. (journal article - meta analysis, research, systematic review) ISSN: 1366-5278 PMID: 20868615 CINAHL AN: 201080035","Waugh N(1), Royle P, Clar C, Henderson R, Cummins E, Hadden D, Lindsay R, Pearson D.",
982,1707,22702,Systematic review and economic modelling of the effectiveness and cost-effectiveness of non-surgical treatments for women with stress urinary incontinence.,Systematic review and economic modelling of the effectiveness and cost-effectiveness of non-surgical treatments for women with stress urinary incontinence.,"Imamura M; Abrams P; Bain C; Buckley B; Cardozo L; Cody J; Cook J; Eustice S; Glazener C; Grant A; et al.; Health Technology Assessment, 2010; 14 (40): 1-506. (journal article - meta analysis, research, systematic review) ISSN: 1366-5278 PMID: 20738930 CINAHL AN: 201075975","Imamura M(1), Abrams P, Bain C, Buckley B, Cardozo L, Cody J, Cook J, Eustice S,  Glazener C, Grant A, Hay-Smith J, Hislop J, Jenkinson D, Kilonzo M, Nabi G, N'Dow J, Pickard R, Ternent L, Wallace S, Wardle J, Zhu S, Vale L.",
983,1709,19683,Physical interventions to interrupt or reduce the spread of respiratory viruses: a Cochrane review.,Physical interventions to interrupt or reduce the spread of respiratory viruses.,"Jefferson T; Del Mar C; Dooley L; Ferroni E; Al-Ansary LA; Bawazeer GA; van Driel ML; Nair S; Foxlee R; Rivetti A; Health Technology Assessment, 2010; 14 (34): 347-476. (journal article - research, systematic review) ISSN: 1366-5278 PMID: 20648717 CINAHL AN: 201072438","Jefferson T(1), Del Mar CB, Dooley L, Ferroni E, Al-Ansary LA, Bawazeer GA, van Driel ML, Nair S, Jones MA, Thorning S, Conly JM.",
984,1711,24233,A systematic review of implant-supported maxillary overdentures after a mean observation period of at least 1 year.,A systematic review of implant-supported maxillary overdentures after a mean observation period of at least 1 year.,"Slot W; Raghoebar GM; Vissink A; Huddleston Slater JJ; Meijer HJA; Journal of Clinical Periodontology, 2010 Jan; 37 (1): 98-110. (journal article - research, systematic review, tables/charts) ISSN: 0303-6979 PMID: 19995402 CINAHL AN: 201050920","Slot W(1), Raghoebar GM, Vissink A, Huddleston Slater JJ, Meijer HJ.",
