,cinahl_no,medline_no,cinahl_title,medline_title,cinahl_author,medline_author,not_dup
475,816,27909,Design makes a difference: a meta-analysis of antidepressant response rates in placebo-controlled versus comparator trials in late-life depression.,Design makes a difference: a meta-analysis of antidepressant response rates in placebo-controlled versus comparator trials in late-life depression.,"Sneed JR; Rutherford BR; Rindskopf D; Lane DT; Sackeim HA; Roose SP; American Journal of Geriatric Psychiatry, 2008 Jan; 16 (1): 65-73. (journal article - equations & formulas, research, systematic review, tables/charts) ISSN: 1064-7481 PMID: 17998306 CINAHL AN: 200975708","Sneed JR(1), Rutherford BR, Rindskopf D, Lane DT, Sackeim HA, Roose SP.",
476,817,27914,Prevention of atrial fibrillation by way of abrogation of the Renin-Angiotensin system: a systematic review and meta-analysis.,Prevention of atrial fibrillation by way of abrogation of the renin-angiotensin system: a systematic review and meta-analysis.,"Jibrini MB; Molnar J; Arora RR; American Journal of Therapeutics, 2008 Jan-Feb; 15 (1): 36-43. (journal article - research, systematic review) ISSN: 1075-2765 PMID: 18223352 CINAHL AN: 200977809","Jibrini MB(1), Molnar J, Arora RR.",
477,818,27916,The effects of mild perioperative hypothermia on blood loss and transfusion requirement.,The effects of mild perioperative hypothermia on blood loss and transfusion requirement.,"Rajagopalan S; Mascha E; Na J; Sessler DI; Anesthesiology, 2008 Jan; 108 (1): 71-7. (journal article - research, systematic review) ISSN: 0003-3022 PMID: 18156884 CINAHL AN: 200976368","Rajagopalan S(1), Mascha E, Na J, Sessler DI.",
478,819,27918,A meta-analysis of pedometer-based walking interventions and weight loss.,A meta-analysis of pedometer-based walking interventions and weight loss.,"Richardson CR; Newton TL; Abraham JJ; Sen A; Jimbo M; Swartz AM; Annals of Family Medicine, 2008 Jan-Feb; 6 (1): 69-77. (journal article - research, systematic review) ISSN: 1544-1709 PMID: 18195317 CINAHL AN: 200976519","Richardson CR(1), Newton TL, Abraham JJ, Sen A, Jimbo M, Swartz AM.",
479,825,26698,Admission avoidance hospital at home.,Admission avoidance hospital at home.,"Shepperd S; Doll H; Angus RM; Clarke MJ; Iliffe S; Kalra L; Ricauda NA; Wilson AD; Cochrane Database of Systematic Reviews, 2008: N.PAG. (journal article - research, systematic review) ISSN: 1469-493X PMID: 18843751 CINAHL AN: 201023117","Shepperd S(1), Doll H, Angus RM, Clarke MJ, Iliffe S, Kalra L, Ricauda NA, Wilson AD.",
480,826,27869,Alendronate for the primary and secondary prevention of osteoporotic fractures in postmenopausal women.,Alendronate for the primary and secondary prevention of osteoporotic fractures in postmenopausal women.,"Wells GA; Cranney A; Peterson J; Boucher M; Shea B; Welch V; Coyle D; Tugwell P; Cochrane Database of Systematic Reviews, 2008: N.PAG. (journal article - research, systematic review) ISSN: 1469-493X PMID: 18253985 CINAHL AN: 200990127","Wells GA(1), Cranney A, Peterson J, Boucher M, Shea B, Robinson V, Coyle D, Tugwell P.",
481,829,27504,Antiepileptic drugs for preventing seizures in people with brain tumors.,Antiepileptic drugs for preventing seizures in people with brain tumors.,"Tremont-Lukats IW; Ratilal BO; Armstrong T; Gilbert MR; Cochrane Database of Systematic Reviews, 2008: N.PAG. (journal article - research, systematic review) ISSN: 1469-493X PMID: 18425902 CINAHL AN: 200994249","Tremont-Lukats IW(1), Ratilal BO, Armstrong T, Gilbert MR.",
482,830,27082,Antioxidant supplements for preventing gastrointestinal cancers.,Antioxidant supplements for preventing gastrointestinal cancers.,"Bjelakovic G; Nikolova D; Simonetti RG; Gluud C; Cochrane Database of Systematic Reviews, 2008: N.PAG. (journal article - research, systematic review) ISSN: 1469-493X PMID: 18677777 CINAHL AN: 200982427","Bjelakovic G(1), Nikolova D, Simonetti RG, Gluud C.",
483,832,27098,Behavioral interventions to reduce risk for sexual transmission of HIV among men who have sex with men.,Behavioral interventions to reduce risk for sexual transmission of HIV among men  who have sex with men.,"Johnson WD; Diaz RM; Flanders WD; Goodman M; Hill AN; Holtgrave D; Malow R; McClellan WM; Cochrane Database of Systematic Reviews, 2008: N.PAG. (journal article - research, systematic review) ISSN: 1469-493X PMID: 18646068 CINAHL AN: 200982235","Johnson WD(1), Diaz RM, Flanders WD, Goodman M, Hill AN, Holtgrave D, Malow R, McClellan WM.",
484,833,29046,Bicycle helmet legislation for the uptake of helmet use and prevention of head injuries.,Bicycle helmet legislation for the uptake of helmet use and prevention of head injuries.,"Macpherson A; Spinks A; Cochrane Database of Systematic Reviews, 2008: N.PAG. (journal article - research, systematic review) ISSN: 1469-493X PMID: 18646128 CINAHL AN: 200982527","Macpherson A, Spinks A.",
485,834,27852,Biocompatible hemodialysis membranes for acute renal failure.,Biocompatible hemodialysis membranes for acute renal failure.,"Alonso A; Lau J; Jaber BL; Cochrane Database of Systematic Reviews, 2008: N.PAG. (journal article - research, systematic review) ISSN: 1469-493X PMID: 18254074 CINAHL AN: 200982449","Alonso A, Lau J, Jaber BL.",
486,835,25119,Blood pressure lowering efficacy of renin inhibitors for primary hypertension.,Blood pressure lowering efficacy of renin inhibitors for primary hypertension: a  Cochrane systematic review.,"Musini VM; Fortin PM; Bassett K; Wright JM; Cochrane Database of Systematic Reviews, 2008: N.PAG. (journal article - research, systematic review) ISSN: 1469-493X PMID: 18843743 CINAHL AN: 201023114","Musini VM(1), Fortin PM, Bassett K, Wright JM.",
487,839,27502,Chinese herbal medicine for primary dysmenorrhoea.,Chinese herbal medicine for primary dysmenorrhoea.,"Zhu X; Proctor M; Bensoussan A; Wu E; Smith CA; Cochrane Database of Systematic Reviews, 2008: N.PAG. (journal article - research, systematic review) ISSN: 1469-493X PMID: 18425916 CINAHL AN: 200982512","Zhu X(1), Proctor M, Bensoussan A, Wu E, Smith CA.",
488,841,27848,Continuous infusion versus intermittent bolus doses of indomethacin for patent ductus arteriosus closure in symptomatic preterm infants.,Continuous infusion versus intermittent bolus doses of indomethacin for patent ductus arteriosus closure in symptomatic preterm infants.,"GÌ¦rk AS; Ehrenkranz RA; Bracken MB; Cochrane Database of Systematic Reviews, 2008: N.PAG. (journal article - research, systematic review) ISSN: 1469-493X PMID: 18254092 CINAHL AN: 200990132","GÌ¦rk AS(1), Ehrenkranz RA, Bracken MB.",
489,842,27862,Cycle regimens for frozen-thawed embryo transfer.,Cycle regimens for frozen-thawed embryo transfer.,"Ghobara T; Vanderkerchove P; Cochrane Database of Systematic Reviews, 2008: N.PAG. (journal article - research, systematic review) ISSN: 1469-493X PMID: 18254019 CINAHL AN: 200990128","Ghobara T(1), Vandekerckhove P.",
490,843,27866,Devices and pressure sources for administration of nasal continuous positive airway pressure (NCPAP) in preterm neonates.,Devices and pressure sources for administration of nasal continuous positive airway pressure (NCPAP) in preterm neonates.,"De Paoli AG; Davis PG; Faber B; Morley CJ; Cochrane Database of Systematic Reviews, 2008: N.PAG. (journal article - research, systematic review) ISSN: 1469-493X PMID: 18254011 CINAHL AN: 200982365","De Paoli AG(1), Davis PG, Faber B, Morley CJ.",
491,844,27492,Dipeptidyl peptidase-4 (DPP-4) inhibitors for type 2 diabetes mellitus.,Dipeptidyl peptidase-4 (DPP-4) inhibitors for type 2 diabetes mellitus.,"Richter B; Bandeira-Echtler E; Bergerhoff K; Lerch C; Cochrane Database of Systematic Reviews, 2008: N.PAG. (journal article - research, systematic review) ISSN: 1469-493X PMID: 18425967 CINAHL AN: 200994255","Richter B(1), Bandeira-Echtler E, Bergerhoff K, Lerch CL.",
492,845,27495,Dopamine agonist therapy in early Parkinson's disease.,Dopamine agonist therapy in early Parkinson's disease.,"Stowe R; Ives N; Clarke CE; van Hilten; Ferreira J; Hawker RJ; Shah L; Wheatley K; Gray R; Cochrane Database of Systematic Reviews, 2008: N.PAG. (journal article - research, systematic review) ISSN: 1469-493X PMID: 18425954 CINAHL AN: 200994254","Stowe RL(1), Ives NJ, Clarke C, van Hilten J, Ferreira J, Hawker RJ, Shah L, Wheatley K, Gray R.",
493,847,27096,Erythromycin for the prevention and treatment of feeding intolerance in preterm infants.,Erythromycin for the prevention and treatment of feeding intolerance in preterm infants.,"Ng E; Shah VS; Cochrane Database of Systematic Reviews, 2008: N.PAG. (journal article - research, systematic review) ISSN: 1469-493X PMID: 18646077 CINAHL AN: 200982300","Ng E(1), Shah VS.",
494,848,27863,Etidronate for the primary and secondary prevention of osteoporotic fractures in postmenopausal women.,Etidronate for the primary and secondary prevention of osteoporotic fractures in  postmenopausal women.,"Wells GA; Cranney A; Peterson J; Boucher M; Shea B; Welch V; Coyle D; Tugwell P; Cochrane Database of Systematic Reviews, 2008: N.PAG. (journal article - research, systematic review) ISSN: 1469-493X PMID: 18254018 CINAHL AN: 200994247","Wells GA(1), Cranney A, Peterson J, Boucher M, Shea B, Robinson V, Coyle D, Tugwell P.",
495,849,27094,Exercise or exercise and diet for preventing type 2 diabetes mellitus.,Exercise or exercise and diet for preventing type 2 diabetes mellitus.,"Orozco LJ; Buchleitner AM; Gimenez-Perez G; RoquÌ© i Figuls M; Richter B; Mauricio D; Cochrane Database of Systematic Reviews, 2008: N.PAG. (journal article - research, systematic review) ISSN: 1469-493X PMID: 18646086 CINAHL AN: 200999312","Orozco LJ(1), Buchleitner AM, Gimenez-Perez G, RoquÌ© I Figuls M, Richter B, Mauricio D.",
496,850,27500,Exercise therapy in juvenile idiopathic arthritis.,Exercise therapy in juvenile idiopathic arthritis.,"Takken T; Van Brussel M; Engelbert RH; van der Net JJ; Kuis W; Helders PP; Cochrane Database of Systematic Reviews, 2008: N.PAG. (journal article - research, systematic review) ISSN: 1469-493X PMID: 18425929 CINAHL AN: 200994251","Takken T(1), van Brussel M, Engelbert RH, Van der Net J, Kuis W, Helders PJ.",
497,851,27861,Glucocorticoid corticosteroids for Duchenne muscular dystrophy.,Glucocorticoid corticosteroids for Duchenne muscular dystrophy.,"Manzur AY; Kuntzer T; Pike M; Swan AV; Cochrane Database of Systematic Reviews, 2008: N.PAG. (journal article - research, systematic review) ISSN: 1469-493X PMID: 18254031 CINAHL AN: 200982411","Manzur AY(1), Kuntzer T, Pike M, Swan A.",
498,854,27860,High-dose chemotherapy with autologous stem cell transplantation in the first line treatment of aggressive non-Hodgkin lymphoma (NHL) in adults.,High-dose chemotherapy with autologous stem cell transplantation in the first line treatment of aggressive non-Hodgkin lymphoma (NHL) in adults.,"Greb A; Bohlius J; Schiefer D; Schwarzer G; Schulz H; Engert A; Cochrane Database of Systematic Reviews, 2008: N.PAG. (journal article - research, systematic review) ISSN: 1469-493X PMID: 18254036 CINAHL AN: 200990128","Greb A, Bohlius J, Schiefer D, Schwarzer G, Schulz H, Engert A.",
499,855,26703,Immunoglobulin prophylaxis in hematological malignancies and hematopoietic stem cell transplantation.,Immunoglobulin prophylaxis in hematological malignancies and hematopoietic stem cell transplantation.,"Raanani P; Gafter-Gvili A; Paul M; Ben-Bassat I; Leibovici L; Shpilberg O; Cochrane Database of Systematic Reviews, 2008: N.PAG. (journal article - research, systematic review) ISSN: 1469-493X PMID: 18843719 CINAHL AN: 201023109","Raanani P(1), Gafter-Gvili A, Paul M, Ben-Bassat I, Leibovici L, Shpilberg O.",
500,856,27095,Injection therapy for subacute and chronic low-back pain.,Injection therapy for subacute and chronic low-back pain.,"Staal JB; de Bie R; de Vet HCW; Hildebrandt J; Nelemans P; Cochrane Database of Systematic Reviews, 2008: N.PAG. (journal article - research, systematic review) ISSN: 1469-493X PMID: 18646078 CINAHL AN: 200999311","Staal JB(1), de Bie R, de Vet HC, Hildebrandt J, Nelemans P.",
501,857,27847,Interventions for preventing injuries in the agricultural industry.,Interventions for preventing injuries in the agricultural industry.,"Rautiainen R; Lehtola MM; Day LM; Schonstein E; Suutarinen J; Salminen S; Verbeek JH; Cochrane Database of Systematic Reviews, 2008: N.PAG. (journal article - research, systematic review) ISSN: 1469-493X PMID: 18254102 CINAHL AN: 200990133","Rautiainen RH(1), Lehtola MM, Day LM, Schonstein E, Suutarinen J, Salminen S, Verbeek J.",
502,858,26708,Interventions for preventing venous thromboembolism in adults undergoing knee arthroscopy.,Interventions for preventing venous thromboembolism in adults undergoing knee arthroscopy.,"Ramos J; Perrotta C; Badariotti G; Berenstein G; Cochrane Database of Systematic Reviews, 2008: N.PAG. (journal article - research, systematic review) ISSN: 1469-493X PMID: 18843687 CINAHL AN: 200982529","Ramos J(1), Perrotta C, Badariotti G, Berenstein G.",
503,860,27510,Intra-pleural fibrinolytic therapy versus conservative management in the treatment of adult parapneumonic effusions and empyema.,Intra-pleural fibrinolytic therapy versus conservative management in the treatment of adult parapneumonic effusions and empyema.,"Cameron RJ; Davies HRHR; Cochrane Database of Systematic Reviews, 2008: N.PAG. (journal article - research, systematic review) ISSN: 1469-493X PMID: 18425881 CINAHL AN: 200982325","Cameron R(1), Davies HR.",
504,862,26712,Medical adjuvant treatment to increase patency of arteriovenous fistulae and grafts.,Medical adjuvant treatment to increase patency of arteriovenous fistulae and grafts.,"Osborn G; Escofet X; Da Silva A; Cochrane Database of Systematic Reviews, 2008: N.PAG. (journal article - research, systematic review) ISSN: 1469-493X PMID: 18843633 CINAHL AN: 200982374","Osborn G(1), Escofet X, Da Silva A.",
505,863,27091,Methods of delivering the placenta at caesarean section.,Methods of delivering the placenta at caesarean section.,"Anorlu RI; Maholwana B; Hofmeyr GJ; Cochrane Database of Systematic Reviews, 2008: N.PAG. (journal article - research, systematic review) ISSN: 1469-493X PMID: 18646109 CINAHL AN: 200999313","Anorlu RI(1), Maholwana B, Hofmeyr GJ.",
506,868,27872,Non-steroidal anti-inflammatory drugs for low back pain.,Non-steroidal anti-inflammatory drugs for low back pain.,"Roelofs PD; Deyo RA; Koes BW; Scholten RJ; van Tulder MW; Cochrane Database of Systematic Reviews, 2008: N.PAG. (journal article - research, systematic review) ISSN: 1469-493X PMID: 18253976 CINAHL AN: 200994248","Roelofs PD(1), Deyo RA, Koes BW, Scholten RJ, van Tulder MW.",
507,870,27864,Omega-3 polyunsaturated fatty acids (PUFA) for type 2 diabetes mellitus.,Omega-3 polyunsaturated fatty acids (PUFA) for type 2 diabetes mellitus.,"Hartweg J; Perera R; Montori VM; Dinneen SF; Neil AH; Farmer AJ; Cochrane Database of Systematic Reviews, 2008: N.PAG. (journal article - research, systematic review) ISSN: 1469-493X PMID: 18254017 CINAHL AN: 200982341","Hartweg J(1), Perera R, Montori V, Dinneen S, Neil HA, Farmer A.",
508,871,27859,Opioids for neonates receiving mechanical ventilation.,Opioids for neonates receiving mechanical ventilation.,"BellÌ_ R; de Waal KA; Zanini R; Cochrane Database of Systematic Reviews, 2008: N.PAG. (journal article - research, systematic review) ISSN: 1469-493X PMID: 18254040 CINAHL AN: 200982435","BellÌ_ R(1), de Waal KA, Zanini R.",
509,872,26697,Organising health care services for persons with an intellectual disability.,Organising health care services for persons with an intellectual disability.,"Balogh R; Ouellette-Kuntz H; Bourne L; Lunsky Y; Colantonio A; Cochrane Database of Systematic Reviews, 2008: N.PAG. (journal article - research, systematic review) ISSN: 1469-493X PMID: 18843752 CINAHL AN: 201023117","Balogh R(1), Ouellette-Kuntz H, Bourne L, Lunsky Y, Colantonio A.",
510,874,26705,Pain relief for the removal of femoral sheath in interventional cardiology adult patients.,Pain relief for the removal of femoral sheath in interventional cardiology adult  patients.,"Wensley C; Kent B; McAleer MB; Savage SM; Stewart JT; Cochrane Database of Systematic Reviews, 2008: N.PAG. (journal article - research, systematic review) ISSN: 1469-493X PMID: 18843700 CINAHL AN: 201023105","Wensley CJ(1), Kent B, McAleer MB, Price SM, Stewart JT.",
511,877,26702,Platinum versus non-platinum chemotherapy regimens for small cell lung cancer.,Platinum versus non-platinum chemotherapy regimens for small cell lung cancer.,"Amarasena IU; Walters JA; Wood-Baker R; Fong K; Cochrane Database of Systematic Reviews, 2008: N.PAG. (journal article - research, systematic review) ISSN: 1469-493X PMID: 18843733 CINAHL AN: 201023112","Amarasena IU(1), Walters JA, Wood-Baker R, Fong K.",
512,878,26707,Procaine treatments for cognition and dementia.,Procaine treatments for cognition and dementia.,"SzatmÌÁri S; Bereczki D; Cochrane Database of Systematic Reviews, 2008: N.PAG. (journal article - research, systematic review) ISSN: 1469-493X PMID: 18843698 CINAHL AN: 201023104","SzatmÌÁri S(1), Bereczki D.",
513,882,27854,Psychotherapeutic treatments for older depressed people.,Psychotherapeutic treatments for older depressed people.,"Wilson K; Mottram PG; Vassilas C; Cochrane Database of Systematic Reviews, 2008: N.PAG. (journal article - research, systematic review) ISSN: 1469-493X PMID: 18254062 CINAHL AN: 200990129","Wilson KC(1), Mottram PG, Vassilas CA.",
514,885,26699,Relaxation for depression.,Relaxation for depression.,"Jorm AF; Morgan AJ; Hetrick SE; Cochrane Database of Systematic Reviews, 2008: N.PAG. (journal article - research, systematic review) ISSN: 1469-493X PMID: 18843744 CINAHL AN: 201023115","Jorm AF(1), Morgan AJ, Hetrick SE.",
515,886,27853,Relaxation therapies for the management of primary hypertension in adults.,Relaxation therapies for the management of primary hypertension in adults.,"Dickinson HO; Beyer FR; Ford GA; Nicolson D; Campbell F; Cook JV; Mason J; Cochrane Database of Systematic Reviews, 2008: N.PAG. (journal article - research, systematic review) ISSN: 1469-493X PMID: 18254065 CINAHL AN: 200990130","Dickinson HO(1), Campbell F, Beyer FR, Nicolson DJ, Cook JV, Ford GA, Mason JM.",
516,887,27856,Risedronate for the primary and secondary prevention of osteoporotic fractures in postmenopausal women.,Risedronate for the primary and secondary prevention of osteoporotic fractures in postmenopausal women.,"Wells GA; Cranney A; Peterson J; Boucher M; Shea B; Welch V; Coyle D; Tugwell P; Cochrane Database of Systematic Reviews, 2008: N.PAG. (journal article - research, systematic review) ISSN: 1469-493X PMID: 18254053 CINAHL AN: 200994249","Wells G(1), Cranney A, Peterson J, Boucher M, Shea B, Robinson V, Coyle D, Tugwell P.",
517,888,27509,Rocuronium versus succinylcholine for rapid sequence induction intubation.,Rocuronium versus succinylcholine for rapid sequence induction intubation.,"Perry JJ; Lee JS; Sillberg VAH; Wells GA; Cochrane Database of Systematic Reviews, 2008: N.PAG. (journal article - research, systematic review) ISSN: 1469-493X PMID: 18425883 CINAHL AN: 200982374","Perry JJ(1), Lee JS, Sillberg VA, Wells GA.",
518,889,27857,Surgical hand antisepsis to reduce surgical site infection.,Surgical hand antisepsis to reduce surgical site infection.,"Tanner J; Swarbrook S; Stuart J; Cochrane Database of Systematic Reviews, 2008: N.PAG. (journal article - research, systematic review) ISSN: 1469-493X PMID: 18254046 CINAHL AN: 200990129","Tanner J(1), Swarbrook S, Stuart J.",
519,891,27870,Synchronized mechanical ventilation for respiratory support in newborn infants.,Synchronized mechanical ventilation for respiratory support in newborn infants.,"Greenough A; Dimitriou G; Prendergast M; Milner AD; Cochrane Database of Systematic Reviews, 2008: N.PAG. (journal article - research, systematic review) ISSN: 1469-493X PMID: 18253979 CINAHL AN: 200982251","Greenough A(1), Dimitriou G, Prendergast M, Milner AD.",
520,892,27499,Targeted therapy for advanced renal cell carcinoma.,Targeted therapy for advanced renal cell carcinoma.,"Coppin C; Le L; Wilt TJ; Kollmannsberger C; Cochrane Database of Systematic Reviews, 2008: N.PAG. (journal article - research, systematic review) ISSN: 1469-493X PMID: 18425931 CINAHL AN: 200994251","Coppin C, Le L, Porzsolt F, Wilt T.",
521,894,27491,Traditional corticosteroids for induction of remission in Crohn's disease.,Traditional corticosteroids for induction of remission in Crohn's disease.,"Benchimol EI; Seow CH; Steinhart AH; Griffiths AM; Cochrane Database of Systematic Reviews, 2008: N.PAG. (journal article - research, systematic review) ISSN: 1469-493X PMID: 18425970 CINAHL AN: 200994255","Benchimol EI(1), Seow CH, Steinhart AH, Griffiths AM.",
522,896,27084,Type I interferons for induction of remission in ulcerative colitis.,Type I interferons for induction of remission in ulcerative colitis.,"Seow CH; Benchimol EI; Griffiths AM; Steinhart AH; Cochrane Database of Systematic Reviews, 2008: N.PAG. (journal article - research, systematic review) ISSN: 1469-493X PMID: 18646167 CINAHL AN: 200999318","Seow CH(1), Benchimol EI, Griffiths AM, Steinhart AH.",
523,898,27961,Empiric antibiotic therapy for suspected ventilator-associated pneumonia: a systematic review and meta-analysis of randomized trials.,Empiric antibiotic therapy for suspected ventilator-associated pneumonia: a systematic review and meta-analysis of randomized trials.,"Aarts MA; Hancock JN; Heyland D; McLeod RS; Marshall JC; Critical Care Medicine, 2008 Jan; 36 (1): 108-17. (journal article - research, systematic review) ISSN: 0090-3493 PMID: 18007262 CINAHL AN: 200975626","Aarts MA(1), Hancock JN, Heyland D, McLeod RS, Marshall JC.",
524,900,27965,Effect of cinnamon on glucose control and lipid parameters.,Effect of cinnamon on glucose control and lipid parameters.,"Baker WL; Gutierrez-Williams G; White CM; Kluger J; Coleman CI; Diabetes Care, 2008 Jan; 31 (1): 41-3. (journal article - research, systematic review) ISSN: 0149-5992 PMID: 17909085 CINAHL AN: 200976401","Baker WL(1), Gutierrez-Williams G, White CM, Kluger J, Coleman CI.",
525,901,27987,Placebo response in the prophylaxis of migraine: a meta-analysis.,Placebo response in the prophylaxis of migraine: a meta-analysis.,"Macedo A; BaÌ±os J; FarrÌ© M; European Journal of Pain, 2008 Jan; 12 (1): 68-75. (journal article - research, systematic review, tables/charts) ISSN: 1090-3801 PMID: 17451980 CINAHL AN: 200975705","Macedo A(1), BaÌ±os JE, FarrÌ© M.",
526,903,27786,'Cut down to quit' with nicotine replacement therapies in smoking cessation: a systematic review of effectiveness and economic analysis.,'Cut down to quit' with nicotine replacement therapies in smoking cessation: a systematic review of effectiveness and economic analysis.,"Wang D; Connock M; Barton P; Fry-Smith A; Aveyard P; Moore D; Health Technology Assessment, 2008; 12 (2): iii-xi, 1-135. (journal article - equations & formulas, glossary, research, systematic review, tables/charts) ISSN: 1366-5278 PMID: 18093448 CINAHL AN: 200977318","Wang D(1), Connock M, Barton P, Fry-Smith A, Aveyard P, Moore D.",
527,904,27415,Ezetimibe for the treatment of hypercholesterolaemia: a systematic review and economic evaluation.,Ezetimibe for the treatment of hypercholesterolaemia: a systematic review and economic evaluation.,"Ara R; Tumur I; Pandor A; Duenas A; Williams R; Wilkinson A; Paisley S; Chilcott J; Health Technology Assessment, 2008; 12 (21): iii, xi-xiii, 1-212. (journal article - research, systematic review) ISSN: 1366-5278 PMID: 18485273 CINAHL AN: 201008877","Ara R(1), Tumur I, Pandor A, Duenas A, Williams R, Wilkinson A, Paisley S, Chilcott J.",
528,906,27416,Systematic review and economic analysis of the comparative effectiveness of different inhaled corticosteroids and their usage with long-acting beta2 agonists for the treatment of chronic asthma in adults and children aged 12 years and over.,Systematic review and economic analysis of the comparative effectiveness of different inhaled corticosteroids and their usage with long-acting beta2 agonists for the treatment of chronic asthma in adults and children aged 12 years and over.,"Shepherd J; Rogers G; Anderson R; Main C; Thompson-Coon J; Hartwell D; Liu Z; Loveman E; Green C; Pitt M; et al.; Health Technology Assessment, 2008; 12 (19): iii-iv, 1-360. (journal article - research, systematic review) ISSN: 1366-5278 PMID: 18485271 CINAHL AN: 201008877","Shepherd J(1), Rogers G, Anderson R, Main C, Thompson-Coon J, Hartwell D, Liu Z,  Loveman E, Green C, Pitt M, Stein K, Harris P, Frampton GK, Smith M, Takeda A, Price A, Welch K, Somerville M.",
529,908,27417,"The use of irinotecan, oxaliplatin and raltitrexed for the treatment of advanced colorectal cancer: systematic review and economic evaluation.","The use of irinotecan, oxaliplatin and raltitrexed for the treatment of advanced  colorectal cancer: systematic review and economic evaluation.","Hind D; Tappenden P; Tumur I; Eggington S; Sutcliffe P; Ryan A; Health Technology Assessment, 2008; 12 (15): iii-ix, xi, 1-162. (journal article - research, systematic review) ISSN: 1366-5278 PMID: 18462574 CINAHL AN: 201008877","Hind D(1), Tappenden P, Tumur I, Eggington S, Sutcliffe P, Ryan A.",
530,910,28020,Preoperative intra-aortic balloon pump in patients undergoing coronary bypass surgery: a systematic review and meta-analysis.,Preoperative intra-aortic balloon pump in patients undergoing coronary bypass surgery: a systematic review and meta-analysis.,"Dyub AM; Whitlock RP; Abouzahr LL; CinÌÊ CS; Journal of Cardiac Surgery, 2008 Jan-Feb; 23 (1): 79-86. (journal article - research, systematic review, tables/charts) ISSN: 0886-0440 PMID: 18290898 CINAHL AN: 200992030","Dyub AM(1), Whitlock RP, Abouzahr LL, CinÌÊ CS.",
